{
  "cin_version": "0.1",
  "design": { "name": "miller_ota", "source": { "kind": "hand" },
    "note": "Two-stage Miller OTA. A0 ~ 500*500, GBW ~ gm1/Cc, p1 ~ 1/(R1*Cc*gm5*R2), RHP zero ~ gm5/Cc." },
  "top": "main",
  "ground": ["0"],
  "definitions": { "main": { "ports": [], "instances": [
    { "name": "V1", "device_type": "vsource", "terminals": { "p": "vin", "n": "0" } },
    { "name": "EP", "device_type": "vcvs",
      "terminals": { "p": "inp", "n": "0", "cp": "vin", "cn": "0" },
      "params": { "gain": "0.5" } },
    { "name": "EN", "device_type": "vcvs",
      "terminals": { "p": "inn", "n": "0", "cp": "vin", "cn": "0" },
      "params": { "gain": "-0.5" } },
    { "name": "M1", "device_type": "mosfet",
      "terminals": { "d": "vx", "g": "inp", "s": "tail", "b": "tail" },
      "params": { "polarity": "n", "gm": "400u", "gds": "0.4u" } },
    { "name": "M2", "device_type": "mosfet",
      "terminals": { "d": "v1", "g": "inn", "s": "tail", "b": "tail" },
      "params": { "polarity": "n", "gm": "400u", "gds": "0.4u" } },
    { "name": "M3", "device_type": "mosfet",
      "terminals": { "d": "vx", "g": "vx", "s": "0", "b": "0" },
      "params": { "polarity": "p", "gm": "400u", "gds": "0.4u" } },
    { "name": "M4", "device_type": "mosfet",
      "terminals": { "d": "v1", "g": "vx", "s": "0", "b": "0" },
      "params": { "polarity": "p", "gm": "400u", "gds": "0.4u" } },
    { "name": "M5", "device_type": "mosfet",
      "terminals": { "d": "vout", "g": "v1", "s": "0", "b": "0" },
      "params": { "polarity": "p", "gm": "2m", "gds": "2u" } },
    { "name": "M6", "device_type": "mosfet",
      "terminals": { "d": "vout", "g": "0", "s": "0", "b": "0" },
      "params": { "polarity": "n", "gds": "2u" } },
    { "name": "CC", "device_type": "capacitor", "terminals": { "p": "v1", "n": "vout" },
      "params": { "c": "1p" } },
    { "name": "CL", "device_type": "capacitor", "terminals": { "p": "vout", "n": "0" },
      "params": { "c": "4p" } }
  ] } }
}
