{
  "cin_version": "0.1",
  "design": { "name": "ota5t", "source": { "kind": "hand" },
    "note": "5T OTA, NMOS pair + PMOS mirror, differential drive via VCVS pair. A0 ~ gm1/(gds2+gds4), p1 ~ (gds2+gds4)/CL. Supply rail is AC ground ('0')." },
  "top": "main",
  "ground": ["0"],
  "definitions": { "main": { "ports": [], "instances": [
    { "name": "V1", "device_type": "vsource", "terminals": { "p": "vin", "n": "0" } },
    { "name": "EP", "device_type": "vcvs",
      "terminals": { "p": "inp", "n": "0", "cp": "vin", "cn": "0" },
      "params": { "gain": "0.5" } },
    { "name": "EN", "device_type": "vcvs",
      "terminals": { "p": "inn", "n": "0", "cp": "vin", "cn": "0" },
      "params": { "gain": "-0.5" } },
    { "name": "M1", "device_type": "mosfet",
      "terminals": { "d": "vx", "g": "inp", "s": "tail", "b": "tail" },
      "params": { "polarity": "n", "gm": "400u", "gds": "0.4u" } },
    { "name": "M2", "device_type": "mosfet",
      "terminals": { "d": "vout", "g": "inn", "s": "tail", "b": "tail" },
      "params": { "polarity": "n", "gm": "400u", "gds": "0.4u" } },
    { "name": "M3", "device_type": "mosfet",
      "terminals": { "d": "vx", "g": "vx", "s": "0", "b": "0" },
      "params": { "polarity": "p", "gm": "400u", "gds": "0.4u" } },
    { "name": "M4", "device_type": "mosfet",
      "terminals": { "d": "vout", "g": "vx", "s": "0", "b": "0" },
      "params": { "polarity": "p", "gm": "400u", "gds": "0.4u" } },
    { "name": "CL", "device_type": "capacitor", "terminals": { "p": "vout", "n": "0" },
      "params": { "c": "1p" } }
  ] } }
}
